{"version": "1.0", "type": "3d", "emitter": {"flow": 40.0, "flowMode": "rate", "flowInterval": 1, "maxParticles": 300, "reservoir": 300, "mode": "Infinite", "reverse": false, "alignDir": false, "billboard": true, "rotationMode": "speed", "gravity": {"x": 0.0, "y": 0.0, "z": 0.0}, "emissionZone": {"shape": "sphere", "radius": 10.0, "width": 100.0, "height": 60.0, "depth": 60.0, "length": 100.0, "mode": "Surface", "rotationX": 0, "rotationY": 0, "rotationZ": 0.0, "showZone": true}, "propagationCone": {"directionX": 0, "directionY": 0.0, "directionZ": 0.0, "spread": 90.0, "showCone": true}, "blendingMode": "Normal"}, "states": [{"id": "state_0", "role": "birth", "label": "birth", "duration": 0.5, "shape": "sphere", "easing": "linear", "starPoints": 5, "starInnerRatio": 0.4, "appearance": {"size": 8, "sizeMax": 12, "color": "#ffaa00", "opacity": 255}, "movement": {"minSpeed": 60, "maxSpeed": 160, "minRotX": 0, "maxRotX": 0, "minRotY": 0, "maxRotY": 0, "minRotZ": -90, "maxRotZ": 90}, "customShapeRefs": []}, {"id": "state_1", "role": "death", "label": "death", "duration": 0.5, "shape": "sphere", "easing": "ease-out", "starPoints": 5, "starInnerRatio": 0.4, "appearance": {"size": 2, "sizeMax": 4, "color": "#ff3300", "opacity": 0}, "movement": {"minSpeed": 20, "maxSpeed": 60, "minRotX": 0, "maxRotX": 0, "minRotY": 0, "maxRotY": 0, "minRotZ": -90, "maxRotZ": 90}, "customShapeRefs": []}]}