{
  "version": "1.0",
  "type": "2d",
  "emitter": {
    "flow": 40,
    "flowMode": "rate",
    "flowInterval": 1,
    "maxParticles": 300,
    "reservoir": 50,
    "mode": "Infinite",
    "reverse": false,
    "alignDir": false,
    "rotationMode": "speed",
    "gravity": {
      "x": 0,
      "y": 200
    },
    "emissionZone": {
      "shape": "Circle",
      "rotation": 0,
      "radius": 50,
      "width": 100,
      "height": 60,
      "length": 100,
      "mode": "Surface",
      "showZone": false
    },
    "propagationCone": {
      "direction": 270,
      "spread": 60,
      "showCone": false
    },
    "blendingMode": "Normal"
  },
  "states": [
    {
      "id": "state_0",
      "role": "birth",
      "label": "birth",
      "duration": 0.5,
      "shape": "circle",
      "easing": "linear",
      "starPoints": 5,
      "starInnerRatio": 0.4,
      "appearance": {
        "size": 8,
        "sizeMax": 12,
        "color": "#ffaa00",
        "opacity": 255
      },
      "movement": {
        "minSpeed": 60,
        "maxSpeed": 160,
        "minRot": -90,
        "maxRot": 90
      },
      "customShapeRefs": []
    },
    {
      "id": "state_1",
      "role": "death",
      "label": "death",
      "duration": 0.5,
      "shape": "circle",
      "easing": "ease-out",
      "starPoints": 5,
      "starInnerRatio": 0.4,
      "appearance": {
        "size": 2,
        "sizeMax": 4,
        "color": "#ff3300",
        "opacity": 0
      },
      "movement": {
        "minSpeed": 20,
        "maxSpeed": 60,
        "minRot": -90,
        "maxRot": 90
      },
      "customShapeRefs": []
    }
  ]
}